rating; comment
4; Los colores son agradables, pero siento que la legibilidad podría mejorarse ajustando la tonalidad de fondo en algunos casos.
2; La falta de adaptabilidad a pantallas de diferentes tamaños hace que la experiencia sea menos consistente en diversos dispositivos.
4; La paleta de colores es decente, aunque en algunos casos la saturación podría ser mayor para resaltar mejor la sintaxis.
3; La paleta tiene su atractivo, pero la disposición general podría mejorar para una apariencia más pulida.
3; Colores con carácter, aunque la mezcla total podría beneficiarse de algunos ajustes.
1; Este tema parece haberse olvidado por completo de la ergonomía visual.Es como si quisieran hacer que la programación sea una tarea visualmente agotadora.
5; La elección de colores es excelente.Hace que la interfaz sea fácil de entender y agradable de usar.
